{
  "name": "aida",
  "version": "0.2.0",
  "description": "AIDA - Agentic Intelligence Digital Assistant. Foundation plugins for extending Claude Code.",
  "owner": {
    "name": "oakensoul"
  },
  "plugins": [
    {
      "name": "aida-core",
      "kind": "plugin",
      "source": {
        "source": "github",
        "repo": "aida-core/aida-core-plugin",
        "ref": "v1.4.6"
      },
      "description": "Foundation plugin for building your custom Claude Code experience. Extension scaffolding, multi-level configuration, and structured session context.",
      "version": "1.4.6",
      "category": "core",
      "homepage": "https://github.com/aida-core/aida-core-plugin",
      "author": {
        "name": "aida-core"
      },
      "tags": [
        "core",
        "extensions",
        "configuration",
        "mementos"
      ]
    }
  ]
}
